{
 "schemaVersion": 1,
 "schemaId": "trs-jack-3d-contract-migration.v1",
 "purpose": "**版と契約変更の対応表の正本。**ここに書いた値が各 artifact の contractMigration へそのまま入る。生成器と検証側が同じ 1 か所から読む。**この定義自身も入力である**（inputDigest に入る）。",
 "why": "v0.4.0 までの contractMigration は「1 つの遷移を書く単一オブジェクト」だった。そこへ、**版を据え置いたまま入れた変更が後から混ぜ込まれ**、`introducedIn` という自由文の列に \"schemaVersion 2\" と \"v0.1.2 (追加のみ)\" と \"v0.3.0 フォローアップ P1-2 (追加のみ)\" が同居していた。項目名の欄に日本語の文が入っている行もあった。**「据え置いたまま変えた」という事実そのものが記録されていなかった。**history 形式にして、回ごとに versionWasHeld を持たせる。",
 "policyDocument": "docs/SCHEMA_VERSIONING_POLICY.md",
 "policyVersion": 1,
 "verifiedBy": "test/contractMigration.test.ts が、各 history 項目の 2 つの schema 実物へ scripts/schemaLanguageDiff.mjs を当てて policyVerdict と effect を突き合わせる。**手で書いた記録が実物とずれたら落ちる。**",
 "migrations": {
  "half-plug-topology-profile.v3": {
   "schemaId": "half-plug-topology-profile.v3",
   "previousSchemaId": "half-plug-topology-profile.v2",
   "fromSchemaVersion": 2,
   "toSchemaVersion": 3,
   "breaking": true,
   "policy": {
    "document": "docs/SCHEMA_VERSIONING_POLICY.md",
    "policyVersion": 1,
    "decisionRule": "language-subset",
    "note": "判定は新旧 2 つの schema だけで行う。artifact の中身は見ない"
   },
   "consumerAction": "**schemaVersion で分岐すること。**2 を期待する実装は 3 を受け取ったら停止し、この表で対応づける。**配布名も変わる**ので、v2 のファイル名で引いている lock は schema 検査へ到達する前に「ファイルが無い」で止まる（renamedAssets）。契約そのもの（区間・event・topology 列・座標系・role の enum）は v2 から変わっていない。",
   "renamedAssets": [
    {
     "from": "half_plug_topology_profile.v2.trs_jack_trs.json",
     "to": "half_plug_topology_profile.v3.trs_jack_trs.json",
     "reason": "配布名に schema の版が入っている。**名前で引く lock はここで止まる**"
    },
    {
     "from": "half_plug_topology_profile.v2.trs_jack_trrs.json",
     "to": "half_plug_topology_profile.v3.trs_jack_trrs.json",
     "reason": "同上"
    },
    {
     "from": "half-plug-topology-profile.v2.schema.json",
     "to": "half-plug-topology-profile.v3.schema.json",
     "reason": "schema ファイル名"
    }
   ],
   "history": [
    {
     "shippedIn": "v0.1.1",
     "previousRelease": "v0.1.0",
     "previousSchemaPath": "schemas/half-plug-topology-profile.v1.schema.json",
     "currentSchemaPath": "schemas/half-plug-topology-profile.v1.schema.json",
     "schemaVersionAtTheTime": 1,
     "schemaVersionShouldHaveBeen": 2,
     "versionWasHeld": true,
     "policyVerdict": "BUMP",
     "recordedRetroactivelyIn": "v0.5.0",
     "changes": [
      {
       "kind": "enum-value-renamed",
       "effect": "UNDECIDABLE",
       "schemaPointer": "/properties/events/items/properties/spreadStatus/enum",
       "instancePath": "$.events[].spreadStatus",
       "removed": [
        "MEASURED",
        "NOT_EVENT_SPECIFIC",
        "NOT_MEASURED"
       ],
       "added": [
        "MODEL_SWEEP_EVENT_SPECIFIC",
        "MODEL_SWEEP_NOT_EVENT_SPECIFIC",
        "NOT_ANALYZED"
       ],
       "reason": "MEASURED が実物の測定と誤読される。実際はモデルのパラメータを振った結果である。**値が入れ替わったので、旧 schema でも新 schema でも一方の artifact は落ちる**"
      },
      {
       "kind": "field-added",
       "effect": "WIDEN",
       "schemaPointer": "/properties/sensitivitySummary/properties/eventSpreadSource",
       "instancePath": "$.sensitivitySummary.eventSpreadSource",
       "added": [
        "eventSpreadSource"
       ],
       "reason": "幅の出どころを機械可読にした"
      }
     ]
    },
    {
     "shippedIn": "v0.2.0",
     "previousRelease": "v0.1.1",
     "previousSchemaPath": "schemas/half-plug-topology-profile.v1.schema.json",
     "currentSchemaPath": "schemas/half-plug-topology-profile.v1.schema.json",
     "schemaVersionAtTheTime": 1,
     "schemaVersionShouldHaveBeen": 2,
     "versionWasHeld": true,
     "policyVerdict": "BUMP",
     "recordedRetroactivelyIn": "v0.5.0",
     "changes": [
      {
       "kind": "field-added",
       "effect": "WIDEN",
       "schemaPointer": "/properties/provenance/properties/inputSettings",
       "instancePath": "$.provenance.inputSettings",
       "added": [
        "inputSettings"
       ],
       "reason": "生成時の設定を残すようにした"
      },
      {
       "kind": "field-reshaped",
       "effect": "WIDEN",
       "schemaPointer": "/properties/sensitivitySummary",
       "instancePath": "$.sensitivitySummary",
       "added": [
        "basis",
        "eventSpreadAvailable",
        "globalSummaryAvailable"
       ],
       "reason": "感度の要約に「何を根拠にしたか」「そもそも取れたか」を足し、必須にした"
      }
     ],
     "note": "**v0.2.0 では v2 を新設したが、同時に v1 の schema ファイルも直していた。**v0.2.0 が配った artifact は v2 なので実害は無かったが、条文には反する"
    },
    {
     "shippedIn": "v0.2.0",
     "previousRelease": "v0.1.1",
     "previousSchemaPath": "schemas/half-plug-topology-profile.v1.schema.json",
     "currentSchemaPath": "schemas/half-plug-topology-profile.v2.schema.json",
     "schemaVersionAtTheTime": 2,
     "versionWasHeld": false,
     "policyVerdict": "BUMP",
     "changes": [
      {
       "kind": "const-changed",
       "effect": "UNDECIDABLE",
       "schemaPointer": "/properties/schemaVersion/const",
       "instancePath": "$.schemaVersion",
       "from": 1,
       "to": 2,
       "reason": "版を上げた。**この回は条文どおりに上げている**"
      },
      {
       "kind": "field-added",
       "effect": "WIDEN",
       "schemaPointer": "/properties/schemaId",
       "instancePath": "$.schemaId",
       "added": [
        "schemaId"
       ],
       "reason": "版だけでなく schema の同一性も持たせた"
      },
      {
       "kind": "field-added",
       "effect": "WIDEN",
       "schemaPointer": "/properties/contractMigration",
       "instancePath": "$.contractMigration",
       "added": [
        "contractMigration"
       ],
       "reason": "対応表そのもの"
      },
      {
       "kind": "field-added",
       "effect": "WIDEN",
       "schemaPointer": "/properties/mechanicalInsertion",
       "instancePath": "$.mechanicalInsertion",
       "added": [
        "mechanicalInsertion"
       ],
       "reason": "機械的な挿入量を電気的トポロジーと分けた"
      },
      {
       "kind": "enum-value-renamed",
       "effect": "UNDECIDABLE",
       "schemaPointer": "/properties/intervals/items/properties/electricalTopology/properties/topologyClass/enum",
       "instancePath": "$.intervals[].electricalTopology.topologyClass",
       "removed": [
        "fully-seated"
       ],
       "added": [
        "all-expected-functions-match"
       ],
       "reason": "「プラグ肩が当たった」と読めたが、実体は reasonCode のとおり ALL_EXPECTED_FUNCTIONS_MATCH でしかない"
      },
      {
       "kind": "field-reshaped",
       "effect": "WIDEN",
       "schemaPointer": "/properties/coordinateSystem",
       "instancePath": "$.coordinateSystem",
       "added": [
        "crossProfileComparable",
        "normalizedNote",
        "normalizedScope"
       ],
       "reason": "正規化座標が variant を跨いで比較できないことを明示した"
      },
      {
       "kind": "field-added",
       "effect": "WIDEN",
       "schemaPointer": "/properties/provenance/properties/inputSettings",
       "instancePath": "$.provenance.inputSettings",
       "added": [
        "inputSettings"
       ],
       "reason": "v1 側と同じ追加"
      },
      {
       "kind": "field-reshaped",
       "effect": "WIDEN",
       "schemaPointer": "/properties/sensitivitySummary",
       "instancePath": "$.sensitivitySummary",
       "added": [
        "basis",
        "eventSpreadAvailable",
        "globalSummaryAvailable"
       ],
       "reason": "v1 側と同じ変更"
      },
      {
       "kind": "constraint-tightened",
       "effect": "NARROW",
       "schemaPointer": "/required",
       "instancePath": "$",
       "added": [
        "contractMigration",
        "mechanicalInsertion",
        "schemaId"
       ],
       "reason": "新しい項目を必須にした"
      }
     ]
    },
    {
     "shippedIn": "v0.4.0",
     "previousRelease": "v0.3.0",
     "previousSchemaPath": "schemas/half-plug-topology-profile.v2.schema.json",
     "currentSchemaPath": "schemas/half-plug-topology-profile.v2.schema.json",
     "schemaVersionAtTheTime": 2,
     "schemaVersionShouldHaveBeen": 3,
     "versionWasHeld": true,
     "policyVerdict": "BUMP",
     "recordedRetroactivelyIn": "v0.5.0",
     "changes": [
      {
       "kind": "enum-value-added",
       "effect": "WIDEN",
       "schemaPointer": "/properties/provenance/properties/inputFiles/items/properties/role/enum",
       "instancePath": "$.provenance.inputFiles[].role",
       "added": [
        "input-scope"
       ],
       "reason": "入力の範囲定義 source-input-scope.v1.json が入力になった。**追加のみだが、旧 schema を pin した consumer はこの値を拒む**"
      }
     ]
    },
    {
     "shippedIn": "v0.5.0",
     "previousRelease": "v0.4.1",
     "previousSchemaPath": "schemas/half-plug-topology-profile.v2.schema.json",
     "currentSchemaPath": "schemas/half-plug-topology-profile.v3.schema.json",
     "schemaVersionAtTheTime": 3,
     "versionWasHeld": false,
     "policyVerdict": "BUMP",
     "changes": [
      {
       "kind": "const-changed",
       "effect": "UNDECIDABLE",
       "schemaPointer": "/properties/schemaVersion/const",
       "instancePath": "$.schemaVersion",
       "from": 2,
       "to": 3,
       "reason": "版を上げた。**下流はここで分岐して止まる**"
      },
      {
       "kind": "const-changed",
       "effect": "UNDECIDABLE",
       "schemaPointer": "/properties/schemaId/const",
       "instancePath": "$.schemaId",
       "from": "half-plug-topology-profile.v2",
       "to": "half-plug-topology-profile.v3",
       "reason": "schema の同一性も上げた"
      },
      {
       "kind": "field-reshaped",
       "effect": "WIDEN",
       "schemaPointer": "/properties/contractMigration",
       "instancePath": "$.contractMigration",
       "reason": "この履歴そのもの。単一遷移のオブジェクトから history 形式へ変えた。**版を据え置いたまま変えた回を分けて記録できなかった**のが v0.4.0 の取りこぼしの原因"
      },
      {
       "kind": "enum-value-added",
       "effect": "WIDEN",
       "schemaPointer": "/properties/provenance/properties/inputFiles/items/properties/role/enum",
       "instancePath": "$.provenance.inputFiles[].role",
       "added": [
        "contract-migration"
       ],
       "reason": "版と契約変更の対応表の正本 contract-migration.v1.json が入力になった"
      }
     ]
    }
   ]
  },
  "event-sensitivity.v2": {